{
  "schema_version": "0.5.3",
  "work_order_id": "WO-REVIEW-1",
  "worker": "codex",
  "worker_skill": "codex-review-gate",
  "status": "deferred",
  "result_type": "review",
  "raw_output_path": "raw/worker/WO-REVIEW-1.raw.txt",
  "structured_output_path": "raw/worker/WO-REVIEW-1.worker-result.json",
  "files_touched": [],
  "commands_run": [],
  "evidence_refs": [],
  "review": {
    "verdict": "DEFERRED",
    "summary": "Codex review is explicitly deferred and must not be treated as PASS.",
    "blocking_findings": []
  },
  "deferred": {
    "is_deferred": true,
    "reason": "Codex review gate intentionally deferred in prototype smoke."
  },
  "notes": "Deferred Codex review must not be reported as PASS."
}
